"Key","Item Type","Publication Year","Author","Title","Publication Title","ISBN","ISSN","DOI","Url","Abstract Note","Date","Date Added","Date Modified","Access Date","Pages","Num Pages","Issue","Volume","Number Of Volumes","Journal Abbreviation","Short Title","Series","Series Number","Series Text","Series Title","Publisher","Place","Language","Rights","Type","Archive","Archive Location","Library Catalog","Call Number","Extra","Notes","File Attachments","Link Attachments","Manual Tags","Automatic Tags","Editor","Series Editor","Translator","Contributor","Attorney Agent","Book Author","Cast Member","Commenter","Composer","Cosponsor","Counsel","Interviewer","Producer","Recipient","Reviewed Author","Scriptwriter","Words By","Guest","Number","Edition","Running Time","Scale","Medium","Artwork Size","Filing Date","Application Number","Assignee","Issuing Authority","Country","Meeting Name","Conference Name","Court","References","Reporter","Legal Status","Priority Numbers","Programming Language","Version","System","Code","Code Number","Section","Session","Committee","History","Legislative Body"
"C49MN344","blogPost","2020","","Health Insurance Coverage of Low Income Children 0-18 (under 200% FPL)","KFF","","","","https://www.kff.org/other/state-indicator/health-insurance-coverage-of-low-income-children-0-18-under-200-fpl/","The Kaiser Family Foundation website provides in-depth information on key health policy issues including Medicaid, Medicare, health reform, global health, HIV/AIDS, health insurance, the uninsured …","2020-10-23","2022-06-18 12:47:33","2022-06-27 02:33:22","2022-06-21 12:47:33","","","","","","","","","","","","","","en-US","","","","","","","","","C:\Users\andre\Zotero\storage\VRPQ8TZA\health-insurance-coverage-of-low-income-children-0-18-under-200-fpl.html","","","","","","","","","","","","","","","","","","","","","","","","","","","","","","","","","","","","","","","","","","","","","","","","",""
"A6HXUHHG","webpage","","US Census Bureau","American Community Survey 2019 1-year data release.","Census.gov","","","","https://www.census.gov/programs-surveys/acs","","","2022-06-18 12:48:04","2022-06-27 02:38:07","2022-06-21 12:48:04","","","","","","","","","","","","","","","","","","","","","","","C:\Users\andre\Zotero\storage\Q6LKDCKL\table.html","","","","","","","US Census Bureau","","","","","","","","","","","","","","","","","","","","","","","","","","","","","","","","","","","","","","","","","",""
"93954R9R","webpage","","","2010 Census Urban and Rural Classification and Urban Area Criteria","","","","","https://www.census.gov/programs-surveys/geography/guidance/geo-areas/urban-rural/2010-urban-rural.html","","","2022-06-18 12:48:25","2022-06-18 12:48:25","2022-06-18 12:48:25","","","","","","","","","","","","","","","","","","","","","","","C:\Users\andre\Zotero\storage\BDCDKQPP\2010-urban-rural.html","","","","","","","","","","","","","","","","","","","","","","","","","","","","","","","","","","","","","","","","","","","","","","","","",""
"W26HLKY7","journalArticle","2020","Robinson, Lara R.; McCord, Russell F.; Cloud, Lindsay K.; Kaminski, Jennifer W.; Cook, Amy; Amoroso, Jessica; Watts, Maya Hazarika; Kotzky, Kim; Barry, Caroline M.; Johnson, Rebecca; Kelleher, Kelly J.","Trends Over Time and Jurisdiction Variability in Supplemental Security Income and State Supplementary Payment Programs for Children With Disabilities","Journal of public health management and practice: JPHMP","","1550-5022","10.1097/PHH.0000000000001122","","CONTEXT: Nearly 1.2 million children with disabilities received federally administered Supplemental Security Income (SSI) payments in 2017. Based on a robust review of research and evaluation evidence and microsimulations, The National Academies of Sciences, Engineering, and Medicine committee identified modifications to SSI (ie, increasing the federal SSI benefit maximum by one-third or two-thirds) as 1 of 10 strategies that could reduce the US child poverty rate, improving child health and well-being on a population level. OBJECTIVE: Describing the availability and amount of SSI and State Supplementary Payment (SSP) program benefits to support families of children with disabilities may be a first step toward evaluating The National Academies of Sciences, Engineering, and Medicine-proposed modification to SSI as a potential poverty alleviation and health improvement tool for children with disabilities and their families. DESIGN: We used public health law research methods to characterize the laws (statutes and state agency regulations) governing the federal SSI program and SSP programs in the 50 states and District of Columbia from January 1, 1996, through November 1, 2018. RESULTS: The number of jurisdictions offering supplementary payments (SSP) was relatively stable between 1996 and 2018. In 2018, 23 US jurisdictions legally mandated that SSP programs were available for children. Among the states with SSP payment amounts in their codified laws, SSP monthly benefit amounts ranged from $8 to $64.35 in 1996 and $3.13 to $60.43 in 2018. CONCLUSION: Our initial exploration of SSI-related policies as a tool for improving the economic stability of children with disabilities and their families suggests that current SSPs, in combination with SSI, would not rise to the level of SSI increases proposed by The National Academies of Sciences, Engineering, and Medicine. Understanding more about how SSI and SSP reach children and work in combination with other federal and state income security programs may help identify policies and strategies that better support children with disabilities in low-income households.","2020-04","2022-06-25 14:22:11","2022-06-25 14:22:11","","S45-S53","","","26 Suppl 2, Advancing Legal Epidemiology","","J Public Health Manag Pract","","","","","","","","eng","","","","","PubMed","","PMID: 32004222 PMCID: PMC7268284","","; C:\Users\andre\Zotero\storage\N8WIJZA9\Robinson et al. - 2020 - Trends Over Time and Jurisdiction Variability in S.pdf","http://www.ncbi.nlm.nih.gov/pubmed/32004222","","Child; Child, Preschool; Humans; United States; State Government; Diabetes Mellitus; Disabled Children; Social Security","","","","","","","","","","","","","","","","","","","","","","","","","","","","","","","","","","","","","","","","","","","","","",""
"YWHUKQYU","webpage","","","Research: Supplemental Security Income Program Entry at Age 18 and Entrants' Subsequent Earnings","Social Security Administration Research, Statistics, and Policy Analysis","","","","https://www.ssa.gov/policy/docs/ssb/v75n3/v75n3p35.html","Social Security Administration Research, Statistics, and Policy Analysis","","2022-06-25 19:09:15","2022-06-27 02:17:55","2022-06-21 19:09:15","","","","","","","Research","","","","","","","en","","","","","","","","","C:\Users\andre\Zotero\storage\7AIWLPYI\v75n3p35.html","","","","","","","","","","","","","","","","","","","","","","","","","","","","","","","","","","","","","","","","","","","","","","","","",""
"CAS672JC","webpage","","","Supplemental Security Income","","","","","https://www.ssa.gov/ssi/","Apply Online for Disability Benefits.","","2022-06-25 19:10:07","2022-06-27 02:08:34","2022-06-21 19:10:07","","","","","","","","","","","","","","en","","","","","","","","","C:\Users\andre\Zotero\storage\WSEJL76S\ssi.html","","","","","","","","","","","","","","","","","","","","","","","","","","","","","","","","","","","","","","","","","","","","","","","","",""
"HCLG4FYJ","webpage","","","Understanding SSI - SSI for Children","","","","","https://www.ssa.gov/ssi/text-child-ussi.htm","To be eligible for SSI benefits, a child must be either blind or disabled.","","2022-06-25 19:11:45","2022-06-27 02:10:59","2022-06-21 19:11:45","","","","","","","","","","","","","","eng","","","","","","","","","C:\Users\andre\Zotero\storage\F5U9PZQT\text-child-ussi.html","","","","","","","","","","","","","","","","","","","","","","","","","","","","","","","","","","","","","","","","","","","","","","","","",""
"NW5Z23SQ","webpage","","","Understanding SSI - SSI Benefits","","","","","https://www.ssa.gov/ssi/text-benefits-ussi.htm","This page provides information on the maximum Federal benefit which changes yearly.","","2022-06-25 19:12:38","2022-06-27 02:09:29","2022-06-21 19:12:38","","","","","","","","","","","","","","eng","","","","","","","","","C:\Users\andre\Zotero\storage\KCB2PERZ\text-benefits-ussi.html","","","","","","","","","","","","","","","","","","","","","","","","","","","","","","","","","","","","","","","","","","","","","","","","",""
"JYF9LBR7","webpage","","","State Supplemental Payments for Children with Disabilities","","","","","https://www.lawatlas.org/datasets/supplemental-security-income-for-children-with-disabilities","","","2022-06-25 19:13:52","2022-06-27 02:11:27","2022-06-21 19:13:52","","","","","","","","","","","","","","","","","","","","","","","C:\Users\andre\Zotero\storage\DSDYTRAW\supplemental-security-income-for-children-with-disabilities.html","","","","","","","","","","","","","","","","","","","","","","","","","","","","","","","","","","","","","","","","","","","","","","","","",""
"ETTY5JYE","webpage","","","SSI Annual Statistical Report, 2020","","","","","https://www.ssa.gov/policy/docs/statcomps/ssi_asr/2020/index.html","Social Security Administration Research, Statistics, and Policy Analysis","","2022-06-25 19:14:49","2022-06-27 02:11:43","2022-06-21 19:14:49","","","","","","","","","","","","","","en","","","","","","","","","C:\Users\andre\Zotero\storage\E44MLIJ4\index.html","","","","","","","","","","","","","","","","","","","","","","","","","","","","","","","","","","","","","","","","","","","","","","","","",""
"2YERX7Q7","book","2019","National Academies of Sciences, Engineering","A Roadmap to Reducing Child Poverty","","978-0-309-48398-8","","","https://nap.nationalacademies.org/catalog/25246/a-roadmap-to-reducing-child-poverty","Download a PDF of ""A Roadmap to Reducing Child Poverty"" by the National Academies of Sciences, Engineering, and Medicine for free.","2019-02-28","2022-06-25 19:17:19","2022-06-25 19:17:19","2022-06-25 19:17:19","","","","","","","","","","","","","","en","","","","","nap.nationalacademies.org","","DOI: 10.17226/25246","","C:\Users\andre\Zotero\storage\RGR5ZN9Q\National Academies of Sciences - 2019 - A Roadmap to Reducing Child Poverty.pdf; C:\Users\andre\Zotero\storage\SANAULCF\a-roadmap-to-reducing-child-poverty.html","","","","","","","","","","","","","","","","","","","","","","","","","","","","","","","","","","","","","","","","","","","","","","","","",""
"CP82BHJP","journalArticle","","Gettens, John; Lei, Pei-Pei; Henry, Alex","""Accounting for Geographic Variation in Social Security Disability Prog""","Social Security Bulletin","","","","https://escholarship.umassmed.edu/commed_pubs/203/","","","2022-06-25 19:18:26","2022-06-27 02:15:09","2022-06-21 19:18:26","29-47","","2","78","","","","","","","","","","","","","","","","","","","","","","","","","","","","","","","","","","","","","","","","","","","","","","","","","","","","","","","","","","","","","","","","","","","",""
"NKRQBEE6","webpage","","","Accounting for Geographic Variation in Social Security Disability Program Participation","Social Security Administration Research, Statistics, and Policy Analysis","","","","https://www.ssa.gov/policy/docs/ssb/v78n2/v78n2p29.html","There is wide geographic variation in Social Security Disability Insurance and Supplementary Security Income participation across the United States. Some policymakers and members of the public may assume that interregional administrative inconsistencies are a major reason for the geographic variation.","","2022-06-25 19:18:44","2022-06-25 19:18:44","2022-06-25 19:18:44","","","","","","","","","","","","","","en","","","","","","","","","C:\Users\andre\Zotero\storage\R6ESN67V\v78n2p29.html","","","","","","","","","","","","","","","","","","","","","","","","","","","","","","","","","","","","","","","","","","","","","","","","",""
"4QKCYD6K","book","2015","National Academies of Sciences, Engineering","Mental Disorders and Disabilities Among Low-Income Children","","978-0-309-37685-3","","","https://nap.nationalacademies.org/catalog/21780/mental-disorders-and-disabilities-among-low-income-children","Download a PDF of ""Mental Disorders and Disabilities Among Low-Income Children"" by the National Academies of Sciences, Engineering, and Medicine for free.","2015-09-09","2022-06-25 19:20:46","2022-06-25 19:20:46","2022-06-25 19:20:46","","","","","","","","","","","","","","en","","","","","nap.nationalacademies.org","","DOI: 10.17226/21780","","C:\Users\andre\Zotero\storage\8ANPAWDF\mental-disorders-and-disabilities-among-low-income-children.html","","","","","","","","","","","","","","","","","","","","","","","","","","","","","","","","","","","","","","","","","","","","","","","","",""
"CHJ3UAI4","blogPost","2021","Damico, Anthony","A Closer Look at the Remaining Uninsured Population Eligible for Medicaid and CHIP","KFF","","","","https://www.kff.org/uninsured/issue-brief/a-closer-look-at-the-remaining-uninsured-population-eligible-for-medicaid-and-chip/","This issue brief examines the characteristics of the remaining uninsured population who are eligible for Medicaid or CHIP.","2021-11-18","2022-06-25 19:22:02","2022-06-27 02:21:50","2022-06-21 19:22:02","","","","","","","","","","","","","","en-US","","","","","","","","","C:\Users\andre\Zotero\storage\6A3LZSJS\a-closer-look-at-the-remaining-uninsured-population-eligible-for-medicaid-and-chip.html","","","","","","","","","","","","","","","","","","","","","","","","","","","","","","","","","","","","","","","","","","","","","","","","",""
"KYNRGITT","webpage","","","III. The Supplemental Security Income Program","","","","","https://www.ssa.gov/OACT/ssir/SSI16/III_ProgramDescription.html#98370","","","2022-06-25 19:23:25","2022-06-25 19:23:25","2022-06-25 19:23:25","","","","","","","","","","","","","","","","","","","","","","","C:\Users\andre\Zotero\storage\GJ3NMKRM\III_ProgramDescription.html","","","","","","","","","","","","","","","","","","","","","","","","","","","","","","","","","","","","","","","","","","","","","","","","",""
"AXVXUK8J","webpage","","","III. The Supplemental Security Income Program","","","","","https://www.ssa.gov/OACT/ssir/SSI19/III_ProgramDescription.html#98370","","","2022-06-25 19:24:21","2022-06-27 02:22:20","2022-06-21 19:24:21","","","","","","","","","","","","","","","","","","","","","","","C:\Users\andre\Zotero\storage\R78PNSGD\III_ProgramDescription.html","","","","","","","","","","","","","","","","","","","","","","","","","","","","","","","","","","","","","","","","","","","","","","","","",""
"S85QPY9F","blogPost","2022","2022","Status of State Medicaid Expansion Decisions: Interactive Map","KFF","","","","https://www.kff.org/medicaid/issue-brief/status-of-state-medicaid-expansion-decisions-interactive-map/","This page displays an interactive map of the current status of state decisions on the Affordable Care Act’s Medicaid expansion. Additional Medicaid expansion resources are listed (with links)…","2022-06-15","2022-06-25 19:26:02","2022-06-27 02:23:11","2022-06-21 19:26:02","","","","","","","Status of State Medicaid Expansion Decisions","","","","","","","en-US","","","","","","","","","C:\Users\andre\Zotero\storage\4HA4LNIM\status-of-state-medicaid-expansion-decisions-interactive-map.html","","","","","","","","","","","","","","","","","","","","","","","","","","","","","","","","","","","","","","","","","","","","","","","","",""
"73NLUKRI","journalArticle","2017","Hoagwood, Kimberly E.; Zima, Bonnie T.; Buka, Stephen L.; Houtrow, Amy; Kelleher, Kelly J.","State-to-State Variation in SSI Enrollment for Children With Mental Disabilities: An Administrative and Ethical Challenge","Psychiatric Services (Washington, D.C.)","","1557-9700","10.1176/appi.ps.201600118","","OBJECTIVE: The study examined state variation in rates of Supplemental Security Income (SSI) determinations, allowances, and receipt of benefits for ten selected child mental disabilities in 2013. METHODS: SSI administrative and U.S. Census Bureau data collected by a multidisciplinary consensus committee convened by the National Academies of Science, Engineering, and Medicine in 2015 were examined. RESULTS: Less than 1% of children in 2013 were recipients of SSI for mental disabilities. Determination rates ranged from 1,441 to 251 per 100,000 low-income children, an almost sixfold difference. Allowance rates varied from 16% to 78%, a fivefold difference. Receipt of benefits ranged from .7% to 5.3%, a sevenfold difference. CONCLUSIONS: Large unexplained discrepancies across states were found in review and receipt of SSI benefits for low-income children with mental disabilities. Inequities that cannot be explained by disability severity or financial need violate the ethos of equitable access to federally entitled services.","2017-02-01","2022-06-25 19:27:06","2022-06-25 19:27:06","","195-198","","2","68","","Psychiatr Serv","State-to-State Variation in SSI Enrollment for Children With Mental Disabilities","","","","","","","eng","","","","","PubMed","","PMID: 27691374 PMCID: PMC5538568","","C:\Users\andre\Zotero\storage\AYH9ECF7\Hoagwood et al. - 2017 - State-to-State Variation in SSI Enrollment for Chi.pdf; ","http://www.ncbi.nlm.nih.gov/pubmed/27691374","","Child; Humans; United States; Disabled Children; Child and adolescent mental disorders; Child psychiatry/general; Income; Mental disabilities; Persons with Mental Disabilities; Public Assistance; Public policy issues; State policy; Supplemental Security Income","","","","","","","","","","","","","","","","","","","","","","","","","","","","","","","","","","","","","","","","","","","","","",""
"G4YHCZK8","webpage","","Bailey, Michelle; Hemmeter, Jeffrey","Characteristics of Noninstitutionalized DI and SSI Program Participants, 2013 Update","Social Security Administration Research, Statistics, and Policy Analysis","","","","https://www.ssa.gov/policy/docs/rsnotes/rsn2015-02.html","Social Security Administration Research, Statistics, and Policy Analysis","","2022-06-25 19:28:05","2022-06-27 02:30:49","2022-06-21 19:28:05","","","","","","","","","","","","","","en","","","","","","","","","C:\Users\andre\Zotero\storage\2IE9QSAY\rsn2015-02.html","","","","","","","","","","","","","","","","","","","","","","","","","","","","","","","","","","","","","","","","","","","","","","","","",""
"NJX2AU73","webpage","2017","Romig, Kathleen","SSI: A Lifeline for Children with Disabilities","Center on Budget and Policy Priorities","","","","https://www.cbpp.org/research/social-security/ssi-a-lifeline-for-children-with-disabilities","Supplemental Security Income is the only source of federal income support targeted to families caring for children with disabilities, and it reaches only the lowest-income and most severely impaired children.","2017-05-11","2022-06-25 19:28:50","2022-06-27 02:32:00","2022-06-21 19:28:50","","","","","","","SSI","","","","","","","en","","","","","","","","","C:\Users\andre\Zotero\storage\UALLSTTK\ssi-a-lifeline-for-children-with-disabilities.html","","","","","","","","","","","","","","","","","","","","","","","","","","","","","","","","","","","","","","","","","","","","","","","","",""
"XQSYUZ8S","journalArticle","2014","Burkhauser, Richard V.; Houtenville, Andrew J.; Tennant, Jennifer R.","Capturing the Elusive Working-Age Population With Disabilities: Reconciling Conflicting Social Success Estimates From the Current Population Survey and American Community Survey","","","","10.1177/1044207312446226","https://journals.sagepub.com/doi/abs/10.1177/1044207312446226","","2014-06-05","2022-06-25 19:31:18","2022-06-27 02:42:07","2022-06-21 19:31:18","","","4","24","","","","","","","","","","","","","","","","","","","C:\Users\andre\Zotero\storage\GXEFXE84\1044207312446226.html","","","","","","","","","","","","","","","","","","","","","","","","","","","","","","","","","","","","","","","","","","","","","","","","",""
"2EYTIGE9","webpage","","","NSCH Interactive Data Query (2016 – present) - Data Resource Center for Child and Adolescent Health","","","","","https://www.childhealthdata.org/browse/survey","","","2022-06-25 19:33:24","2022-06-27 02:39:04","2022-06-21 19:33:24","","","","","","","","","","","","","","","","","","","","","","","C:\Users\andre\Zotero\storage\Q5DVFHBM\survey.html","","","","","","","","","","","","","","","","","","","","","","","","","","","","","","","","","","","","","","","","","","","","","","","","",""
"3YBMB4PX","journalArticle","2018","Levy, Joseph; Rosenberg, Marjorie; Vanness, David","A Transparent and Consistent Approach to Assess US Outpatient Drug Costs for Use in Cost-Effectiveness Analyses","Value in Health: The Journal of the International Society for Pharmacoeconomics and Outcomes Research","","1524-4733","10.1016/j.jval.2017.06.013","","BACKGROUND: Assessment of drug costs for cost-effectiveness analyses (CEAs) in the United States is not straightforward because the prices paid for drugs are not publicly available and differ between payers. CEAs have relied on list prices that do not reflect the rebates and discounts known to be associated with these purchases. OBJECTIVES: To review available cost measures and propose a novel strategy that is transparent, consistent, and applicable to all CEAs taking a US health care sector perspective or a societal payer's perspective. METHODS: We propose using the National Average Drug Acquisition Cost (NADAC), the Veterans Affairs Federal Supply Schedule (VAFSS), and their midpoint as the upper bound, lower bound, and base case, respectively, to estimate net drug prices for various payers. We compare this approach with wholesale acquisition cost (WAC), the most common measure observed in our literature review. The minimum WAC is used to provide the most conservative comparison. RESULTS: Our sample consists of 1436 brand drugs and 1599 generic drugs. On average, the upper bound (NADAC) is 1% and 9.8% lower than the WAC for brand and generic drugs respectively, whereas the lower bound (VAFSS) is 48.3% and 54.2% lower than the WAC. The NADAC is less than the WAC in 89.6% of drug groups. The distributions of these relationships do not show a clear mode and have wide variation. CONCLUSIONS: Our study suggests that the WAC may be an overestimate for the base case because the minimum WAC is higher than the NADAC for most drugs. Our approach balances uncertainty and lack of data for the cost of pharmaceuticals with the need for a transparent and consistent approach for valid CEAs.","2018-06","2022-06-25 19:34:47","2022-06-25 19:34:47","","677-684","","6","21","","Value Health","","","","","","","","eng","","","","","PubMed","","PMID: 29909872 PMCID: PMC6394851","","C:\Users\andre\Zotero\storage\HQNLB38Q\Levy et al. - 2018 - A Transparent and Consistent Approach to Assess US.pdf; ","http://www.ncbi.nlm.nih.gov/pubmed/29909872","","Humans; Outpatients; United States; Cost-Benefit Analysis; cost-effectiveness analysis; drug cost; Drug Costs; Drug Industry; Drugs, Generic; Economics, Pharmaceutical; health economic methods; United States Department of Veterans Affairs","","","","","","","","","","","","","","","","","","","","","","","","","","","","","","","","","","","","","","","","","","","","","",""
"3CQM9VM3","journalArticle","2018","Levy, Joseph; Rosenberg, Marjorie; Vanness, David","A Transparent and Consistent Approach to Assess US Outpatient Drug Costs for Use in Cost-Effectiveness Analyses","Value in Health","","1098-3015, 1524-4733","10.1016/j.jval.2017.06.013","https://www.valueinhealthjournal.com/article/S1098-3015(17)30316-9/fulltext","","2018-06-01","2022-06-25 19:35:06","2022-06-25 19:35:06","2022-06-25 19:35:06","677-684","","6","21","","Value in Health","","","","","","","","English","","","","","www.valueinhealthjournal.com","","Publisher: Elsevier PMID: 29909872","","C:\Users\andre\Zotero\storage\PCC9TVJX\Levy et al. - 2018 - A Transparent and Consistent Approach to Assess US.pdf; ; C:\Users\andre\Zotero\storage\TV2SPJBI\fulltext.html","http://www.ncbi.nlm.nih.gov/pubmed/29909872","","United States; cost-effectiveness analysis; drug cost; health economic methods","","","","","","","","","","","","","","","","","","","","","","","","","","","","","","","","","","","","","","","","","","","","","",""
"GMPCT577","webpage","","US Census Bureau","2010 Census Urban and Rural Classification and Urban Area Criteria","Census.gov","","","","https://www.census.gov/programs-surveys/geography/guidance/geo-areas/urban-rural/2010-urban-rural.html","Urban-rural classification is fundamentally a delineation of geographical areas, identifying both individual urban areas and the rural areas of the nation.","","2022-06-25 19:40:46","2022-06-27 02:34:12","2022-06-25 19:40:46","","","","","","","","","","","","","","","","","","","","","Section: Government","","C:\Users\andre\Zotero\storage\D42RI27S\2010-urban-rural.html","","","","","","","","","","","","","","","","","","","","","","","","","","","","","","","","","","","","","","","","","","","","","","","","",""
